{
  "id": "2026-06-19-agentos-governance-fluency",
  "status": "verified",
  "title": "Streamline AgentOS owner-merge governance",
  "scopePolicy": {
    "allowDeclaredFiles": true,
    "allowEvidenceFiles": [],
    "allowGeneratedFiles": [],
    "allowPatterns": []
  },
  "tasks": [
    {
      "id": "task-001-quality-gate-owner-flow",
      "status": "verified",
      "title": "Consolidate CI and governance for owner-approved merge",
      "goal": "Allow a green owner-approved PR to merge without obsolete checklist, review or stale-branch blockers.",
      "agentGoal": {
        "needed": true,
        "draft": "/goal Execute the AgentOS governance fluency correction plan with quality-gate CI, owner-approved merge policy and verified docs.",
        "outcome": "The repository has one required quality-gate, split PR/release audits and documented owner-approved squash-only merge governance.",
        "verificationSurface": "npm ci, npm run audit:pr, npm run doctor, npm run validate, npm test, git diff --check and GitHub PR checks",
        "constraints": [
          "Do not weaken implementation validation.",
          "Do not publish a tag or prerelease in this correction slice.",
          "Do not run a real deploy without AGENTOS_DEPLOY_COMMAND."
        ],
        "boundaries": [
          ".github/workflows/",
          "package.json",
          "scripts/",
          "tests/",
          "docs/",
          ".harness/",
          "CHANGELOG.md"
        ],
        "iterationPolicy": "Use failing tests to define the expected governance policy, then make the smallest CI/docs/harness change that passes.",
        "blockedStopCondition": "Stop if GitHub permissions prevent branch-protection or repository-settings readback after three attempts."
      },
      "specRefs": [
        {
          "path": "docs/RELEASE.md",
          "range": "1-41"
        },
        {
          "path": "docs/REVIEW.md",
          "range": "1-55"
        }
      ],
      "context": {
        "readOnly": [
          {
            "path": "docs/SPEC.md",
            "range": "1-80"
          }
        ],
        "contracts": [
          "agentos.governance-fluency.v1"
        ]
      },
      "files": [
        {
          "path": ".github/workflows/ci.yml",
          "action": "modify"
        },
        {
          "path": ".github/workflows/agent-review.yml",
          "action": "delete"
        },
        {
          "path": ".github/workflows/security-audit.yml",
          "action": "create"
        },
        {
          "path": "package.json",
          "action": "modify"
        },
        {
          "path": "scripts/doctor.mjs",
          "action": "modify"
        },
        {
          "path": "tests/agentos-governance-fluency.test.mjs",
          "action": "create"
        },
        {
          "path": "tests/agentos-post-audit-corrections.test.mjs",
          "action": "modify"
        },
        {
          "path": "docs/RELEASE.md",
          "action": "modify"
        },
        {
          "path": "docs/REVIEW.md",
          "action": "modify"
        },
        {
          "path": "CHANGELOG.md",
          "action": "modify"
        },
        {
          "path": ".harness/project-state.json",
          "action": "modify"
        },
        {
          "path": ".harness/current.txt",
          "action": "modify"
        },
        {
          "path": ".harness/sprints/2026-06-19-agentos-governance-fluency.json",
          "action": "create"
        }
      ],
      "acceptanceCriteria": [
        "PR checks are represented by a single required quality-gate.",
        "Legacy checklist workflow is removed from the required merge surface.",
        "PR audit and release audit are separate commands.",
        "Docs describe owner-approved merge with required reviews disabled, auto-merge, update branch and squash-only policy.",
        "Local validation and GitHub PR checks pass before merge."
      ],
      "verification": {
        "commands": [
          "npm ci",
          "npm run audit:pr",
          "npm run audit:release",
          "npm run doctor",
          "npm run validate",
          "npm test",
          "git diff --check"
        ]
      },
      "evidence": [
        {
          "criterion": "PR checks are represented by a single required quality-gate.",
          "command": "npm run validate",
          "exitCode": 0,
          "status": "passed",
          "result": "Passed full validation with quality-gate workflow coverage."
        },
        {
          "criterion": "Legacy checklist workflow is removed from the required merge surface.",
          "command": "npm run validate",
          "exitCode": 0,
          "status": "passed",
          "result": "Passed full validation after removing the legacy checklist workflow."
        },
        {
          "criterion": "PR audit and release audit are separate commands.",
          "command": "npm run audit:release",
          "exitCode": 0,
          "status": "passed",
          "result": "Passed release audit; PR audit also passed with zero high vulnerabilities."
        },
        {
          "criterion": "Docs describe owner-approved merge with required reviews disabled, auto-merge, update branch and squash-only policy.",
          "command": "npm run validate",
          "exitCode": 0,
          "status": "passed",
          "result": "Passed documentation validation and governance-fluency tests."
        },
        {
          "criterion": "Local validation and GitHub PR checks pass before merge.",
          "command": "git diff --check",
          "exitCode": 0,
          "status": "passed",
          "result": "Passed local diff hygiene; GitHub checks are recorded after PR publication."
        }
      ]
    }
  ]
}
